{
  "schema_version": 1,
  "coordinate_space": {
    "unit": "normalized",
    "width": 1,
    "height": 1
  },
  "source": {
    "svg": "../evidence/source-with-text.svg",
    "view_box": [
      0,
      0,
      1382.4991,
      426.8002
    ],
    "canvas_width": 1382.4991,
    "canvas_height": 426.8002,
    "region_crop": {
      "region": {
        "x": 0.257381,
        "y": 0.556507,
        "width": 0.470425,
        "height": 0.319029
      },
      "page_view_box": [
        0.0,
        0.0,
        2938.83,
        1337.81
      ],
      "crop_window": [
        756.399,
        744.5006,
        1382.4991,
        426.8002
      ],
      "dropped_source_refs": [
        {
          "text_index": 0,
          "tspan_index": 0,
          "character_range": [
            0,
            37
          ]
        },
        {
          "text_index": 0,
          "tspan_index": 1,
          "character_range": [
            0,
            10
          ]
        },
        {
          "text_index": 1,
          "tspan_index": 0,
          "character_range": [
            0,
            5
          ]
        },
        {
          "text_index": 2,
          "tspan_index": 0,
          "character_range": [
            0,
            17
          ]
        },
        {
          "text_index": 3,
          "tspan_index": 0,
          "character_range": [
            0,
            22
          ]
        },
        {
          "text_index": 4,
          "tspan_index": 0,
          "character_range": [
            0,
            17
          ]
        },
        {
          "text_index": 5,
          "tspan_index": 0,
          "character_range": [
            0,
            22
          ]
        },
        {
          "text_index": 6,
          "tspan_index": 0,
          "character_range": [
            0,
            17
          ]
        },
        {
          "text_index": 7,
          "tspan_index": 0,
          "character_range": [
            0,
            10
          ]
        },
        {
          "text_index": 7,
          "tspan_index": 1,
          "character_range": [
            0,
            103
          ]
        },
        {
          "text_index": 7,
          "tspan_index": 2,
          "character_range": [
            0,
            97
          ]
        },
        {
          "text_index": 7,
          "tspan_index": 3,
          "character_range": [
            0,
            25
          ]
        },
        {
          "text_index": 8,
          "tspan_index": 0,
          "character_range": [
            0,
            5
          ]
        },
        {
          "text_index": 9,
          "tspan_index": 0,
          "character_range": [
            0,
            53
          ]
        }
      ],
      "images_pruned": 0,
      "evidence_images_pruned": 0
    }
  },
  "artwork_text_exemptions": [],
  "slots": []
}
