{
  "schema_version": 1,
  "coordinate_space": {
    "unit": "normalized",
    "width": 1,
    "height": 1
  },
  "source": {
    "svg": "../evidence/source-with-text.svg",
    "view_box": [
      0.0,
      0.0,
      1920.0,
      1080.0
    ],
    "canvas_width": 1920.0,
    "canvas_height": 1080.0
  },
  "artwork_text_exemptions": [],
  "slots": [
    {
      "id": "01-compensation",
      "role": "title",
      "html_tag": "h1",
      "example_value": "01. COMPENSATION",
      "editable": true,
      "allow_empty": true,
      "bounds": {
        "x": 0.0422846,
        "y": 0.3970694,
        "width": 0.5237917,
        "height": 0.112963
      },
      "anchor": "start",
      "horizontal_align": "left",
      "vertical_align": "top",
      "rotation": 0.0,
      "z_order": 1,
      "typography": {
        "font_family": "ProximaNova-ExtrabldIt",
        "font_size": 100.0,
        "font_size_unit": "source-unit",
        "font_weight": "800",
        "font_style": "italic",
        "line_height": 1.0,
        "letter_spacing": "normal",
        "color": "#ffffff"
      },
      "source_refs": [
        {
          "text_index": 0,
          "tspan_index": 0,
          "run_index": 0,
          "character_range": [
            0,
            17
          ]
        }
      ],
      "style_overrides": [
        "example_value",
        "bounds",
        "font_family",
        "font_size",
        "font_weight",
        "font_style",
        "line_height",
        "letter_spacing",
        "color",
        "horizontal_align",
        "vertical_align",
        "rotation"
      ]
    },
    {
      "id": "l-ng-th-ng",
      "role": "title",
      "html_tag": "h1",
      "example_value": "LƯƠNG THƯỞNG",
      "editable": true,
      "allow_empty": true,
      "bounds": {
        "x": 0.0422846,
        "y": 0.5081806,
        "width": 0.409375,
        "height": 0.112963
      },
      "anchor": "start",
      "horizontal_align": "left",
      "vertical_align": "top",
      "rotation": 0.0,
      "z_order": 2,
      "typography": {
        "font_family": "ProximaNova-ExtrabldIt",
        "font_size": 100.0,
        "font_size_unit": "source-unit",
        "font_weight": "800",
        "font_style": "italic",
        "line_height": 1.0,
        "letter_spacing": "normal",
        "color": "#ffffff"
      },
      "source_refs": [
        {
          "text_index": 0,
          "tspan_index": 1,
          "run_index": 0,
          "character_range": [
            0,
            12
          ]
        }
      ],
      "style_overrides": [
        "example_value",
        "bounds",
        "font_family",
        "font_size",
        "font_weight",
        "font_style",
        "line_height",
        "letter_spacing",
        "color",
        "horizontal_align",
        "vertical_align",
        "rotation"
      ]
    },
    {
      "id": "l-ng-ph-c-l-i-2026",
      "role": "label",
      "html_tag": "span",
      "example_value": "LƯƠNG & PHÚC LỢI 2026",
      "editable": true,
      "allow_empty": true,
      "bounds": {
        "x": 0.0378802,
        "y": 0.0635298,
        "width": 0.1239552,
        "height": 0.0225926
      },
      "anchor": "start",
      "horizontal_align": "left",
      "vertical_align": "top",
      "rotation": 0.0,
      "z_order": 3,
      "typography": {
        "font_family": "ProximaNova-Bold",
        "font_size": 20.0,
        "font_size_unit": "source-unit",
        "font_weight": "bold",
        "font_style": "normal",
        "line_height": 1.0,
        "letter_spacing": "normal",
        "color": "#ffffff"
      },
      "source_refs": [
        {
          "text_index": 1,
          "tspan_index": 0,
          "run_index": 0,
          "character_range": [
            0,
            21
          ]
        }
      ],
      "style_overrides": [
        "example_value",
        "bounds",
        "font_family",
        "font_size",
        "font_weight",
        "font_style",
        "line_height",
        "letter_spacing",
        "color",
        "horizontal_align",
        "vertical_align",
        "rotation"
      ]
    },
    {
      "id": "2026-sun-studio-all-rights-reserved",
      "role": "body",
      "html_tag": "p",
      "example_value": "©2026 SUN.STUDIO ALL RIGHTS RESERVED",
      "editable": true,
      "allow_empty": true,
      "bounds": {
        "x": 0.0378802,
        "y": 0.9118817,
        "width": 0.2068824,
        "height": 0.0225926
      },
      "anchor": "start",
      "horizontal_align": "left",
      "vertical_align": "top",
      "rotation": 0.0,
      "z_order": 4,
      "typography": {
        "font_family": "ProximaNova-Regular",
        "font_size": 20.0,
        "font_size_unit": "source-unit",
        "font_weight": "400",
        "font_style": "normal",
        "line_height": 1.0,
        "letter_spacing": "normal",
        "color": "#ffffff"
      },
      "source_refs": [
        {
          "text_index": 2,
          "tspan_index": 0,
          "run_index": 0,
          "character_range": [
            0,
            36
          ]
        }
      ],
      "style_overrides": [
        "example_value",
        "bounds",
        "font_family",
        "font_size",
        "font_weight",
        "font_style",
        "line_height",
        "letter_spacing",
        "color",
        "horizontal_align",
        "vertical_align",
        "rotation"
      ]
    },
    {
      "id": "4",
      "role": "label",
      "html_tag": "span",
      "example_value": "4",
      "editable": true,
      "allow_empty": true,
      "bounds": {
        "x": 0.9547135,
        "y": 0.9118817,
        "width": 0.0075,
        "height": 0.0225926
      },
      "anchor": "start",
      "horizontal_align": "left",
      "vertical_align": "top",
      "rotation": 0.0,
      "z_order": 5,
      "typography": {
        "font_family": "ProximaNova-Semibold",
        "font_size": 20.0,
        "font_size_unit": "source-unit",
        "font_weight": "bold",
        "font_style": "normal",
        "line_height": 1.0,
        "letter_spacing": "normal",
        "color": "#ffffff"
      },
      "source_refs": [
        {
          "text_index": 3,
          "tspan_index": 0,
          "run_index": 0,
          "character_range": [
            0,
            1
          ]
        }
      ],
      "style_overrides": [
        "example_value",
        "bounds",
        "font_family",
        "font_size",
        "font_weight",
        "font_style",
        "line_height",
        "letter_spacing",
        "color",
        "horizontal_align",
        "vertical_align",
        "rotation"
      ]
    },
    {
      "id": "hra-department",
      "role": "label",
      "html_tag": "span",
      "example_value": "HRA DEPARTMENT",
      "editable": true,
      "allow_empty": true,
      "bounds": {
        "x": 0.8600721,
        "y": 0.0768748,
        "width": 0.0906011,
        "height": 0.0225926
      },
      "anchor": "start",
      "horizontal_align": "left",
      "vertical_align": "top",
      "rotation": 0.0,
      "z_order": 6,
      "typography": {
        "font_family": "ProximaNova-Regular",
        "font_size": 20.0,
        "font_size_unit": "source-unit",
        "font_weight": "400",
        "font_style": "normal",
        "line_height": 1.0,
        "letter_spacing": "normal",
        "color": "#ffffff"
      },
      "source_refs": [
        {
          "text_index": 4,
          "tspan_index": 0,
          "run_index": 0,
          "character_range": [
            0,
            14
          ]
        }
      ],
      "style_overrides": [
        "example_value",
        "bounds",
        "font_family",
        "font_size",
        "font_weight",
        "font_style",
        "line_height",
        "letter_spacing",
        "color",
        "horizontal_align",
        "vertical_align",
        "rotation"
      ]
    }
  ]
}
