{
  "schema_version": 1,
  "coordinate_space": {
    "unit": "normalized",
    "width": 1,
    "height": 1
  },
  "source": {
    "svg": "../evidence/source-with-text.svg",
    "view_box": [
      0.0,
      0.0,
      1920.0,
      1080.0
    ],
    "canvas_width": 1920.0,
    "canvas_height": 1080.0
  },
  "artwork_text_exemptions": [],
  "slots": [
    {
      "id": "2026-sun-studio",
      "role": "label",
      "html_tag": "span",
      "example_value": "©2026 SUN.STUDIO",
      "editable": true,
      "allow_empty": true,
      "bounds": {
        "x": 0.0390874,
        "y": 0.9108709,
        "width": 0.0962917,
        "height": 0.0225926
      },
      "anchor": "start",
      "horizontal_align": "left",
      "vertical_align": "top",
      "rotation": 0.0,
      "z_order": 1,
      "typography": {
        "font_family": "ProximaNova-Semibold",
        "font_size": 20.0,
        "font_size_unit": "source-unit",
        "font_weight": "bold",
        "font_style": "normal",
        "line_height": 1.0,
        "letter_spacing": "normal",
        "color": "#ffffff"
      },
      "source_refs": [
        {
          "text_index": 0,
          "tspan_index": 0,
          "run_index": 0,
          "character_range": [
            0,
            16
          ]
        }
      ],
      "style_overrides": [
        "example_value",
        "bounds",
        "font_family",
        "font_size",
        "font_weight",
        "font_style",
        "line_height",
        "letter_spacing",
        "color",
        "horizontal_align",
        "vertical_align",
        "rotation"
      ]
    },
    {
      "id": "all-rights-reserved",
      "role": "label",
      "html_tag": "span",
      "example_value": "ALL RIGHTS RESERVED",
      "editable": true,
      "allow_empty": true,
      "bounds": {
        "x": 0.1358479,
        "y": 0.9108709,
        "width": 0.1120053,
        "height": 0.0225926
      },
      "anchor": "start",
      "horizontal_align": "left",
      "vertical_align": "top",
      "rotation": 0.0,
      "z_order": 2,
      "typography": {
        "font_family": "ProximaNova-Regular",
        "font_size": 20.0,
        "font_size_unit": "source-unit",
        "font_weight": "400",
        "font_style": "normal",
        "line_height": 1.0,
        "letter_spacing": "normal",
        "color": "#ffffff"
      },
      "source_refs": [
        {
          "text_index": 1,
          "tspan_index": 0,
          "run_index": 0,
          "character_range": [
            0,
            20
          ]
        }
      ],
      "style_overrides": [
        "example_value",
        "bounds",
        "font_family",
        "font_size",
        "font_weight",
        "font_style",
        "line_height",
        "letter_spacing",
        "color",
        "horizontal_align",
        "vertical_align",
        "rotation"
      ]
    },
    {
      "id": "thanks",
      "role": "title",
      "html_tag": "h1",
      "example_value": "THANKS",
      "editable": true,
      "allow_empty": true,
      "bounds": {
        "x": 0.0389342,
        "y": 0.2624229,
        "width": 0.2899986,
        "height": 0.1549963
      },
      "anchor": "start",
      "horizontal_align": "left",
      "vertical_align": "top",
      "rotation": 0.0,
      "z_order": 3,
      "typography": {
        "font_family": "Proxima Nova",
        "font_size": 137.2098,
        "font_size_unit": "source-unit",
        "font_weight": "800",
        "font_style": "normal",
        "line_height": 1.0,
        "letter_spacing": "normal",
        "color": "#ffffff"
      },
      "source_refs": [
        {
          "text_index": 2,
          "tspan_index": 0,
          "run_index": 0,
          "character_range": [
            0,
            6
          ]
        }
      ],
      "style_overrides": [
        "example_value",
        "bounds",
        "font_family",
        "font_size",
        "font_weight",
        "font_style",
        "line_height",
        "letter_spacing",
        "color",
        "horizontal_align",
        "vertical_align",
        "rotation"
      ]
    },
    {
      "id": "for-watching",
      "role": "title",
      "html_tag": "h1",
      "example_value": "FOR WATCHING",
      "editable": true,
      "allow_empty": true,
      "bounds": {
        "x": 0.0401491,
        "y": 0.3997598,
        "width": 0.5303087,
        "height": 0.1549963
      },
      "anchor": "start",
      "horizontal_align": "left",
      "vertical_align": "top",
      "rotation": 0.0,
      "z_order": 4,
      "typography": {
        "font_family": "Proxima Nova",
        "font_size": 137.2098,
        "font_size_unit": "source-unit",
        "font_weight": "800",
        "font_style": "normal",
        "line_height": 1.0,
        "letter_spacing": "normal",
        "color": "#ffffff"
      },
      "source_refs": [
        {
          "text_index": 2,
          "tspan_index": 1,
          "run_index": 0,
          "character_range": [
            0,
            12
          ]
        }
      ],
      "style_overrides": [
        "example_value",
        "bounds",
        "font_family",
        "font_size",
        "font_weight",
        "font_style",
        "line_height",
        "letter_spacing",
        "color",
        "horizontal_align",
        "vertical_align",
        "rotation"
      ]
    },
    {
      "id": "ch-c-c-c-sun-er-c-m-t-n-m-b-t-ph-m-c-ti-u-v",
      "role": "subheading",
      "html_tag": "h3",
      "example_value": "Chúc các Sun-er có một năm bứt phá mục tiêu và",
      "editable": true,
      "allow_empty": true,
      "bounds": {
        "x": 0.0401568,
        "y": 0.578073,
        "width": 0.4164053,
        "height": 0.039537
      },
      "anchor": "start",
      "horizontal_align": "left",
      "vertical_align": "top",
      "rotation": 0.0,
      "z_order": 5,
      "typography": {
        "font_family": "Proxima Nova",
        "font_size": 35.0,
        "font_size_unit": "source-unit",
        "font_weight": "bold",
        "font_style": "italic",
        "line_height": 1.0,
        "letter_spacing": "normal",
        "color": "#fff140"
      },
      "source_refs": [
        {
          "text_index": 3,
          "tspan_index": 0,
          "run_index": 0,
          "character_range": [
            0,
            47
          ]
        }
      ],
      "style_overrides": [
        "example_value",
        "bounds",
        "font_family",
        "font_size",
        "font_weight",
        "font_style",
        "line_height",
        "letter_spacing",
        "color",
        "horizontal_align",
        "vertical_align",
        "rotation"
      ]
    },
    {
      "id": "t-nhi-u-th-nh-t-u-m-i-t-i-sun-studio",
      "role": "subheading",
      "html_tag": "h3",
      "example_value": "đạt nhiều thành tựu mới tại SUN.STUDIO",
      "editable": true,
      "allow_empty": true,
      "bounds": {
        "x": 0.0401568,
        "y": 0.6169619,
        "width": 0.3339475,
        "height": 0.039537
      },
      "anchor": "start",
      "horizontal_align": "left",
      "vertical_align": "top",
      "rotation": 0.0,
      "z_order": 6,
      "typography": {
        "font_family": "Proxima Nova",
        "font_size": 35.0,
        "font_size_unit": "source-unit",
        "font_weight": "bold",
        "font_style": "italic",
        "line_height": 1.0,
        "letter_spacing": "normal",
        "color": "#fff140"
      },
      "source_refs": [
        {
          "text_index": 3,
          "tspan_index": 1,
          "run_index": 0,
          "character_range": [
            0,
            38
          ]
        }
      ],
      "style_overrides": [
        "example_value",
        "bounds",
        "font_family",
        "font_size",
        "font_weight",
        "font_style",
        "line_height",
        "letter_spacing",
        "color",
        "horizontal_align",
        "vertical_align",
        "rotation"
      ]
    }
  ]
}
