{
  "schema_version": 1,
  "coordinate_space": {
    "unit": "normalized",
    "width": 1,
    "height": 1
  },
  "source": {
    "svg": "../evidence/source-with-text.svg",
    "view_box": [
      0.0,
      0.0,
      960.0,
      540.0
    ],
    "canvas_width": 960.0,
    "canvas_height": 540.0
  },
  "artwork_text_exemptions": [],
  "slots": [
    {
      "id": "this-is-a-sub-tittle-that-gives-the-audience-a-h",
      "role": "body",
      "html_tag": "p",
      "example_value": "This is a sub-tittle that gives the audience a hint",
      "editable": true,
      "allow_empty": true,
      "bounds": {
        "x": 0.0520833,
        "y": 0.8306883,
        "width": 0.4492791,
        "height": 0.0451852
      },
      "anchor": "start",
      "horizontal_align": "left",
      "vertical_align": "top",
      "rotation": 0.0,
      "z_order": 1,
      "typography": {
        "font_family": "Arial",
        "font_size": 20.0,
        "font_size_unit": "source-unit",
        "font_weight": "400",
        "font_style": "normal",
        "line_height": 1.0,
        "letter_spacing": "normal",
        "color": "#ffffff"
      },
      "source_refs": [
        {
          "text_index": 0,
          "tspan_index": 0,
          "run_index": 0,
          "character_range": [
            0,
            52
          ]
        }
      ],
      "style_overrides": [
        "example_value",
        "bounds",
        "font_family",
        "font_size",
        "font_weight",
        "font_style",
        "line_height",
        "letter_spacing",
        "color",
        "horizontal_align",
        "vertical_align",
        "rotation"
      ]
    },
    {
      "id": "as-to-where-we-re-going",
      "role": "label",
      "html_tag": "span",
      "example_value": "as to where we’re going",
      "editable": true,
      "allow_empty": true,
      "bounds": {
        "x": 0.0520833,
        "y": 0.8732809,
        "width": 0.2195688,
        "height": 0.0451852
      },
      "anchor": "start",
      "horizontal_align": "left",
      "vertical_align": "top",
      "rotation": 0.0,
      "z_order": 2,
      "typography": {
        "font_family": "Arial",
        "font_size": 20.0,
        "font_size_unit": "source-unit",
        "font_weight": "400",
        "font_style": "normal",
        "line_height": 1.0,
        "letter_spacing": "normal",
        "color": "#ffffff"
      },
      "source_refs": [
        {
          "text_index": 0,
          "tspan_index": 1,
          "run_index": 0,
          "character_range": [
            0,
            23
          ]
        }
      ],
      "style_overrides": [
        "example_value",
        "bounds",
        "font_family",
        "font_size",
        "font_weight",
        "font_style",
        "line_height",
        "letter_spacing",
        "color",
        "horizontal_align",
        "vertical_align",
        "rotation"
      ]
    },
    {
      "id": "project",
      "role": "title",
      "html_tag": "h1",
      "example_value": "Project",
      "editable": true,
      "allow_empty": true,
      "bounds": {
        "x": 0.0520833,
        "y": 0.4613015,
        "width": 0.2849,
        "height": 0.1807407
      },
      "anchor": "start",
      "horizontal_align": "left",
      "vertical_align": "top",
      "rotation": 0.0,
      "z_order": 3,
      "typography": {
        "font_family": "Arial",
        "font_size": 80.0,
        "font_size_unit": "source-unit",
        "font_weight": "400",
        "font_style": "normal",
        "line_height": 1.0,
        "letter_spacing": "normal",
        "color": "#ffffff"
      },
      "source_refs": [
        {
          "text_index": 1,
          "tspan_index": 0,
          "run_index": 0,
          "character_range": [
            0,
            7
          ]
        }
      ],
      "style_overrides": [
        "example_value",
        "bounds",
        "font_family",
        "font_size",
        "font_weight",
        "font_style",
        "line_height",
        "letter_spacing",
        "color",
        "horizontal_align",
        "vertical_align",
        "rotation"
      ]
    },
    {
      "id": "presentation",
      "role": "title",
      "html_tag": "h1",
      "example_value": "Presentation",
      "editable": true,
      "allow_empty": true,
      "bounds": {
        "x": 0.0520833,
        "y": 0.6094496,
        "width": 0.4600417,
        "height": 0.1807407
      },
      "anchor": "start",
      "horizontal_align": "left",
      "vertical_align": "top",
      "rotation": 0.0,
      "z_order": 4,
      "typography": {
        "font_family": "Arial",
        "font_size": 80.0,
        "font_size_unit": "source-unit",
        "font_weight": "400",
        "font_style": "normal",
        "line_height": 1.0,
        "letter_spacing": "normal",
        "color": "#ffffff"
      },
      "source_refs": [
        {
          "text_index": 1,
          "tspan_index": 1,
          "run_index": 0,
          "character_range": [
            0,
            12
          ]
        }
      ],
      "style_overrides": [
        "example_value",
        "bounds",
        "font_family",
        "font_size",
        "font_weight",
        "font_style",
        "line_height",
        "letter_spacing",
        "color",
        "horizontal_align",
        "vertical_align",
        "rotation"
      ]
    },
    {
      "id": "date",
      "role": "label",
      "html_tag": "span",
      "example_value": "Date.",
      "editable": true,
      "allow_empty": true,
      "bounds": {
        "x": 0.8831502,
        "y": 0.0451509,
        "width": 0.0303928,
        "height": 0.0225926
      },
      "anchor": "start",
      "horizontal_align": "left",
      "vertical_align": "top",
      "rotation": 0.0,
      "z_order": 5,
      "typography": {
        "font_family": "Arial",
        "font_size": 10.0,
        "font_size_unit": "source-unit",
        "font_weight": "bold",
        "font_style": "normal",
        "line_height": 1.0,
        "letter_spacing": "normal",
        "color": "#ff5533"
      },
      "source_refs": [
        {
          "text_index": 2,
          "tspan_index": 0,
          "run_index": 0,
          "character_range": [
            0,
            5
          ]
        }
      ],
      "style_overrides": [
        "example_value",
        "bounds",
        "font_family",
        "font_size",
        "font_weight",
        "font_style",
        "line_height",
        "letter_spacing",
        "color",
        "horizontal_align",
        "vertical_align",
        "rotation"
      ]
    },
    {
      "id": "10-2025",
      "role": "label",
      "html_tag": "span",
      "example_value": "10/2025",
      "editable": true,
      "allow_empty": true,
      "bounds": {
        "x": 0.9089315,
        "y": 0.0451509,
        "width": 0.0421561,
        "height": 0.0225926
      },
      "anchor": "start",
      "horizontal_align": "left",
      "vertical_align": "top",
      "rotation": 0.0,
      "z_order": 6,
      "typography": {
        "font_family": "Arial",
        "font_size": 10.0,
        "font_size_unit": "source-unit",
        "font_weight": "400",
        "font_style": "normal",
        "line_height": 1.0,
        "letter_spacing": "normal",
        "color": "#ff5533"
      },
      "source_refs": [
        {
          "text_index": 3,
          "tspan_index": 0,
          "run_index": 0,
          "character_range": [
            0,
            8
          ]
        }
      ],
      "style_overrides": [
        "example_value",
        "bounds",
        "font_family",
        "font_size",
        "font_weight",
        "font_style",
        "line_height",
        "letter_spacing",
        "color",
        "horizontal_align",
        "vertical_align",
        "rotation"
      ]
    },
    {
      "id": "project-presentation",
      "role": "label",
      "html_tag": "span",
      "example_value": "Project Presentation",
      "editable": true,
      "allow_empty": true,
      "bounds": {
        "x": 0.7559601,
        "y": 0.0451509,
        "width": 0.1037519,
        "height": 0.0225926
      },
      "anchor": "start",
      "horizontal_align": "left",
      "vertical_align": "top",
      "rotation": 0.0,
      "z_order": 7,
      "typography": {
        "font_family": "Arial",
        "font_size": 10.0,
        "font_size_unit": "source-unit",
        "font_weight": "bold",
        "font_style": "normal",
        "line_height": 1.0,
        "letter_spacing": "normal",
        "color": "#ffffff"
      },
      "source_refs": [
        {
          "text_index": 4,
          "tspan_index": 0,
          "run_index": 0,
          "character_range": [
            0,
            20
          ]
        }
      ],
      "style_overrides": [
        "example_value",
        "bounds",
        "font_family",
        "font_size",
        "font_weight",
        "font_style",
        "line_height",
        "letter_spacing",
        "color",
        "horizontal_align",
        "vertical_align",
        "rotation"
      ]
    }
  ]
}
