{
  "schema_version": 1,
  "coordinate_space": {
    "unit": "normalized",
    "width": 1,
    "height": 1
  },
  "source": {
    "svg": "../evidence/source-with-text.svg",
    "view_box": [
      0.0,
      0.0,
      960.0,
      540.0
    ],
    "canvas_width": 960.0,
    "canvas_height": 540.0
  },
  "artwork_text_exemptions": [],
  "slots": [
    {
      "id": "project-presentation",
      "role": "label",
      "html_tag": "span",
      "example_value": "Project Presentation",
      "editable": true,
      "allow_empty": true,
      "bounds": {
        "x": 0.7559601,
        "y": 0.0451515,
        "width": 0.1037519,
        "height": 0.0225926
      },
      "anchor": "start",
      "horizontal_align": "left",
      "vertical_align": "top",
      "rotation": 0.0,
      "z_order": 1,
      "typography": {
        "font_family": "Arial",
        "font_size": 10.0,
        "font_size_unit": "source-unit",
        "font_weight": "bold",
        "font_style": "normal",
        "line_height": 1.0,
        "letter_spacing": "normal",
        "color": "#ff5533"
      },
      "source_refs": [
        {
          "text_index": 0,
          "tspan_index": 0,
          "run_index": 0,
          "character_range": [
            0,
            20
          ]
        }
      ],
      "style_overrides": [
        "example_value",
        "bounds",
        "font_family",
        "font_size",
        "font_weight",
        "font_style",
        "line_height",
        "letter_spacing",
        "color",
        "horizontal_align",
        "vertical_align",
        "rotation"
      ]
    },
    {
      "id": "session-tittle",
      "role": "label",
      "html_tag": "span",
      "example_value": "Session Tittle",
      "editable": true,
      "allow_empty": true,
      "bounds": {
        "x": 0.8846164,
        "y": 0.0451515,
        "width": 0.0650094,
        "height": 0.0225926
      },
      "anchor": "start",
      "horizontal_align": "left",
      "vertical_align": "top",
      "rotation": 0.0,
      "z_order": 2,
      "typography": {
        "font_family": "Arial",
        "font_size": 10.0,
        "font_size_unit": "source-unit",
        "font_weight": "400",
        "font_style": "normal",
        "line_height": 1.0,
        "letter_spacing": "normal",
        "color": "#ff5533"
      },
      "source_refs": [
        {
          "text_index": 1,
          "tspan_index": 0,
          "run_index": 0,
          "character_range": [
            0,
            14
          ]
        }
      ],
      "style_overrides": [
        "example_value",
        "bounds",
        "font_family",
        "font_size",
        "font_weight",
        "font_style",
        "line_height",
        "letter_spacing",
        "color",
        "horizontal_align",
        "vertical_align",
        "rotation"
      ]
    },
    {
      "id": "pay-attention",
      "role": "heading",
      "html_tag": "h2",
      "example_value": "Pay attention!",
      "editable": true,
      "allow_empty": true,
      "bounds": {
        "x": 0.0520833,
        "y": 0.32641,
        "width": 0.39375,
        "height": 0.1355556
      },
      "anchor": "start",
      "horizontal_align": "left",
      "vertical_align": "top",
      "rotation": 0.0,
      "z_order": 3,
      "typography": {
        "font_family": "Arial",
        "font_size": 60.0,
        "font_size_unit": "source-unit",
        "font_weight": "400",
        "font_style": "normal",
        "line_height": 1.0,
        "letter_spacing": "normal",
        "color": "#ffffff"
      },
      "source_refs": [
        {
          "text_index": 2,
          "tspan_index": 0,
          "run_index": 0,
          "character_range": [
            0,
            14
          ]
        }
      ],
      "style_overrides": [
        "example_value",
        "bounds",
        "font_family",
        "font_size",
        "font_weight",
        "font_style",
        "line_height",
        "letter_spacing",
        "color",
        "horizontal_align",
        "vertical_align",
        "rotation"
      ]
    },
    {
      "id": "it-s-the-scan",
      "role": "heading",
      "html_tag": "h2",
      "example_value": "It’s the SCAN",
      "editable": true,
      "allow_empty": true,
      "bounds": {
        "x": 0.0520833,
        "y": 0.4375211,
        "width": 0.4091001,
        "height": 0.1355556
      },
      "anchor": "start",
      "horizontal_align": "left",
      "vertical_align": "top",
      "rotation": 0.0,
      "z_order": 4,
      "typography": {
        "font_family": "Arial",
        "font_size": 60.0,
        "font_size_unit": "source-unit",
        "font_weight": "400",
        "font_style": "normal",
        "line_height": 1.0,
        "letter_spacing": "normal",
        "color": "#ffffff"
      },
      "source_refs": [
        {
          "text_index": 2,
          "tspan_index": 1,
          "run_index": 0,
          "character_range": [
            0,
            14
          ]
        }
      ],
      "style_overrides": [
        "example_value",
        "bounds",
        "font_family",
        "font_size",
        "font_weight",
        "font_style",
        "line_height",
        "letter_spacing",
        "color",
        "horizontal_align",
        "vertical_align",
        "rotation"
      ]
    },
    {
      "id": "me-moment",
      "role": "heading",
      "html_tag": "h2",
      "example_value": "ME moment.",
      "editable": true,
      "allow_empty": true,
      "bounds": {
        "x": 0.0520833,
        "y": 0.5486322,
        "width": 0.3738563,
        "height": 0.1355556
      },
      "anchor": "start",
      "horizontal_align": "left",
      "vertical_align": "top",
      "rotation": 0.0,
      "z_order": 5,
      "typography": {
        "font_family": "Arial",
        "font_size": 60.0,
        "font_size_unit": "source-unit",
        "font_weight": "400",
        "font_style": "normal",
        "line_height": 1.0,
        "letter_spacing": "normal",
        "color": "#ffffff"
      },
      "source_refs": [
        {
          "text_index": 2,
          "tspan_index": 2,
          "run_index": 0,
          "character_range": [
            0,
            10
          ]
        }
      ],
      "style_overrides": [
        "example_value",
        "bounds",
        "font_family",
        "font_size",
        "font_weight",
        "font_style",
        "line_height",
        "letter_spacing",
        "color",
        "horizontal_align",
        "vertical_align",
        "rotation"
      ]
    },
    {
      "id": "04",
      "role": "label",
      "html_tag": "span",
      "example_value": "04",
      "editable": true,
      "allow_empty": true,
      "bounds": {
        "x": 0.9360845,
        "y": 0.9366667,
        "width": 0.0135417,
        "height": 0.0225926
      },
      "anchor": "start",
      "horizontal_align": "left",
      "vertical_align": "top",
      "rotation": 0.0,
      "z_order": 6,
      "typography": {
        "font_family": "Arial",
        "font_size": 10.0,
        "font_size_unit": "source-unit",
        "font_weight": "400",
        "font_style": "normal",
        "line_height": 1.0,
        "letter_spacing": "normal",
        "color": "#ffffff"
      },
      "source_refs": [
        {
          "text_index": 3,
          "tspan_index": 0,
          "run_index": 0,
          "character_range": [
            0,
            2
          ]
        }
      ],
      "style_overrides": [
        "example_value",
        "bounds",
        "font_family",
        "font_size",
        "font_weight",
        "font_style",
        "line_height",
        "letter_spacing",
        "color",
        "horizontal_align",
        "vertical_align",
        "rotation"
      ]
    }
  ]
}
