{
  "schema_version": 1,
  "coordinate_space": {
    "unit": "normalized",
    "width": 1,
    "height": 1
  },
  "source": {
    "svg": "../evidence/source-with-text.svg",
    "view_box": [
      0.0,
      0.0,
      1920.0,
      1080.0
    ],
    "canvas_width": 1920.0,
    "canvas_height": 1080.0
  },
  "artwork_text_exemptions": [],
  "slots": [
    {
      "id": "v-sao-nh-gi-cu-i-n-m",
      "role": "title",
      "html_tag": "h1",
      "example_value": "VÌ SAO ĐÁNH GIÁ CUỐI NĂM",
      "editable": true,
      "allow_empty": true,
      "bounds": {
        "x": 0.2145447,
        "y": 0.447721,
        "width": 0.5648334,
        "height": 0.0903704
      },
      "anchor": "start",
      "horizontal_align": "left",
      "vertical_align": "top",
      "rotation": 0.0,
      "z_order": 1,
      "typography": {
        "font_family": "Proxima Nova",
        "font_size": 80.0,
        "font_size_unit": "source-unit",
        "font_weight": "800",
        "font_style": "normal",
        "line_height": 1.0,
        "letter_spacing": "normal",
        "color": "#ffffff"
      },
      "source_refs": [
        {
          "text_index": 0,
          "tspan_index": 0,
          "run_index": 0,
          "character_range": [
            0,
            24
          ]
        }
      ],
      "style_overrides": [
        "example_value",
        "bounds",
        "font_family",
        "font_size",
        "font_weight",
        "font_style",
        "line_height",
        "letter_spacing",
        "color",
        "horizontal_align",
        "vertical_align",
        "rotation"
      ]
    },
    {
      "id": "quan-tr-ng",
      "role": "title",
      "html_tag": "h1",
      "example_value": "QUAN TRỌNG?",
      "editable": true,
      "allow_empty": true,
      "bounds": {
        "x": 0.3527947,
        "y": 0.5366099,
        "width": 0.3059541,
        "height": 0.0903704
      },
      "anchor": "start",
      "horizontal_align": "left",
      "vertical_align": "top",
      "rotation": 0.0,
      "z_order": 2,
      "typography": {
        "font_family": "Proxima Nova",
        "font_size": 80.0,
        "font_size_unit": "source-unit",
        "font_weight": "800",
        "font_style": "normal",
        "line_height": 1.0,
        "letter_spacing": "normal",
        "color": "#ffffff"
      },
      "source_refs": [
        {
          "text_index": 0,
          "tspan_index": 1,
          "run_index": 0,
          "character_range": [
            0,
            11
          ]
        }
      ],
      "style_overrides": [
        "example_value",
        "bounds",
        "font_family",
        "font_size",
        "font_weight",
        "font_style",
        "line_height",
        "letter_spacing",
        "color",
        "horizontal_align",
        "vertical_align",
        "rotation"
      ]
    },
    {
      "id": "01",
      "role": "heading",
      "html_tag": "h2",
      "example_value": "01.",
      "editable": true,
      "allow_empty": true,
      "bounds": {
        "x": 0.172703,
        "y": 0.2273928,
        "width": 0.0569937,
        "height": 0.0677778
      },
      "anchor": "start",
      "horizontal_align": "left",
      "vertical_align": "top",
      "rotation": 0.0,
      "z_order": 3,
      "typography": {
        "font_family": "ProximaNova-Black",
        "font_size": 60.0,
        "font_size_unit": "source-unit",
        "font_weight": "bold",
        "font_style": "normal",
        "line_height": 1.0,
        "letter_spacing": "normal",
        "color": "#ffffff"
      },
      "source_refs": [
        {
          "text_index": 1,
          "tspan_index": 0,
          "run_index": 0,
          "character_range": [
            0,
            3
          ]
        }
      ],
      "style_overrides": [
        "example_value",
        "bounds",
        "font_family",
        "font_size",
        "font_weight",
        "font_style",
        "line_height",
        "letter_spacing",
        "color",
        "horizontal_align",
        "vertical_align",
        "rotation"
      ]
    },
    {
      "id": "2026-sun-studio",
      "role": "label",
      "html_tag": "span",
      "example_value": "©2026 SUN.STUDIO",
      "editable": true,
      "allow_empty": true,
      "bounds": {
        "x": 0.0391123,
        "y": 0.9135185,
        "width": 0.0962917,
        "height": 0.0225926
      },
      "anchor": "start",
      "horizontal_align": "left",
      "vertical_align": "top",
      "rotation": 0.0,
      "z_order": 4,
      "typography": {
        "font_family": "ProximaNova-Semibold",
        "font_size": 20.0,
        "font_size_unit": "source-unit",
        "font_weight": "bold",
        "font_style": "normal",
        "line_height": 1.0,
        "letter_spacing": "normal",
        "color": "#ffffff"
      },
      "source_refs": [
        {
          "text_index": 2,
          "tspan_index": 0,
          "run_index": 0,
          "character_range": [
            0,
            16
          ]
        }
      ],
      "style_overrides": [
        "example_value",
        "bounds",
        "font_family",
        "font_size",
        "font_weight",
        "font_style",
        "line_height",
        "letter_spacing",
        "color",
        "horizontal_align",
        "vertical_align",
        "rotation"
      ]
    },
    {
      "id": "all-rights-reserved",
      "role": "label",
      "html_tag": "span",
      "example_value": "ALL RIGHTS RESERVED",
      "editable": true,
      "allow_empty": true,
      "bounds": {
        "x": 0.1358728,
        "y": 0.9135185,
        "width": 0.1120053,
        "height": 0.0225926
      },
      "anchor": "start",
      "horizontal_align": "left",
      "vertical_align": "top",
      "rotation": 0.0,
      "z_order": 5,
      "typography": {
        "font_family": "ProximaNova-Regular",
        "font_size": 20.0,
        "font_size_unit": "source-unit",
        "font_weight": "400",
        "font_style": "normal",
        "line_height": 1.0,
        "letter_spacing": "normal",
        "color": "#ffffff"
      },
      "source_refs": [
        {
          "text_index": 3,
          "tspan_index": 0,
          "run_index": 0,
          "character_range": [
            0,
            20
          ]
        }
      ],
      "style_overrides": [
        "example_value",
        "bounds",
        "font_family",
        "font_size",
        "font_weight",
        "font_style",
        "line_height",
        "letter_spacing",
        "color",
        "horizontal_align",
        "vertical_align",
        "rotation"
      ]
    },
    {
      "id": "3",
      "role": "label",
      "html_tag": "span",
      "example_value": "3",
      "editable": true,
      "allow_empty": true,
      "bounds": {
        "x": 0.9549562,
        "y": 0.9135185,
        "width": 0.0075,
        "height": 0.0225926
      },
      "anchor": "start",
      "horizontal_align": "left",
      "vertical_align": "top",
      "rotation": 0.0,
      "z_order": 6,
      "typography": {
        "font_family": "ProximaNova-Semibold",
        "font_size": 20.0,
        "font_size_unit": "source-unit",
        "font_weight": "bold",
        "font_style": "normal",
        "line_height": 1.0,
        "letter_spacing": "normal",
        "color": "#ffffff"
      },
      "source_refs": [
        {
          "text_index": 4,
          "tspan_index": 0,
          "run_index": 0,
          "character_range": [
            0,
            1
          ]
        }
      ],
      "style_overrides": [
        "example_value",
        "bounds",
        "font_family",
        "font_size",
        "font_weight",
        "font_style",
        "line_height",
        "letter_spacing",
        "color",
        "horizontal_align",
        "vertical_align",
        "rotation"
      ]
    }
  ]
}
