{
  "schema_version": 1,
  "coordinate_space": {
    "unit": "normalized",
    "width": 1,
    "height": 1
  },
  "source": {
    "svg": "../evidence/source-with-text.svg",
    "view_box": [
      0.0,
      0.0,
      1920.0,
      1080.0
    ],
    "canvas_width": 1920.0,
    "canvas_height": 1080.0
  },
  "artwork_text_exemptions": [],
  "slots": [
    {
      "id": "2026-sun-studio",
      "role": "label",
      "html_tag": "span",
      "example_value": "©2026 SUN.STUDIO",
      "editable": true,
      "allow_empty": true,
      "bounds": {
        "x": 0.0380188,
        "y": 0.9133132,
        "width": 0.0962917,
        "height": 0.0225926
      },
      "anchor": "start",
      "horizontal_align": "left",
      "vertical_align": "top",
      "rotation": 0.0,
      "z_order": 1,
      "typography": {
        "font_family": "ProximaNova-Semibold",
        "font_size": 20.0,
        "font_size_unit": "source-unit",
        "font_weight": "bold",
        "font_style": "normal",
        "line_height": 1.0,
        "letter_spacing": "normal",
        "color": "#171717"
      },
      "source_refs": [
        {
          "text_index": 0,
          "tspan_index": 0,
          "run_index": 0,
          "character_range": [
            0,
            16
          ]
        }
      ],
      "style_overrides": [
        "example_value",
        "bounds",
        "font_family",
        "font_size",
        "font_weight",
        "font_style",
        "line_height",
        "letter_spacing",
        "color",
        "horizontal_align",
        "vertical_align",
        "rotation"
      ]
    },
    {
      "id": "all-rights-reserved",
      "role": "label",
      "html_tag": "span",
      "example_value": "ALL RIGHTS RESERVED",
      "editable": true,
      "allow_empty": true,
      "bounds": {
        "x": 0.1347792,
        "y": 0.9133132,
        "width": 0.1120053,
        "height": 0.0225926
      },
      "anchor": "start",
      "horizontal_align": "left",
      "vertical_align": "top",
      "rotation": 0.0,
      "z_order": 2,
      "typography": {
        "font_family": "ProximaNova-Regular",
        "font_size": 20.0,
        "font_size_unit": "source-unit",
        "font_weight": "400",
        "font_style": "normal",
        "line_height": 1.0,
        "letter_spacing": "normal",
        "color": "#171717"
      },
      "source_refs": [
        {
          "text_index": 1,
          "tspan_index": 0,
          "run_index": 0,
          "character_range": [
            0,
            20
          ]
        }
      ],
      "style_overrides": [
        "example_value",
        "bounds",
        "font_family",
        "font_size",
        "font_weight",
        "font_style",
        "line_height",
        "letter_spacing",
        "color",
        "horizontal_align",
        "vertical_align",
        "rotation"
      ]
    },
    {
      "id": "workshop-chu-n-b-n-i-b",
      "role": "subheading",
      "html_tag": "h3",
      "example_value": "Workshop chuẩn bị nội bộ",
      "editable": true,
      "allow_empty": true,
      "bounds": {
        "x": 0.0388969,
        "y": 0.5913693,
        "width": 0.2186475,
        "height": 0.0406667
      },
      "anchor": "start",
      "horizontal_align": "left",
      "vertical_align": "top",
      "rotation": 0.0,
      "z_order": 3,
      "typography": {
        "font_family": "Proxima Nova",
        "font_size": 36.0,
        "font_size_unit": "source-unit",
        "font_weight": "bold",
        "font_style": "italic",
        "line_height": 1.0,
        "letter_spacing": "normal",
        "color": "#171717"
      },
      "source_refs": [
        {
          "text_index": 2,
          "tspan_index": 0,
          "run_index": 0,
          "character_range": [
            0,
            24
          ]
        }
      ],
      "style_overrides": [
        "example_value",
        "bounds",
        "font_family",
        "font_size",
        "font_weight",
        "font_style",
        "line_height",
        "letter_spacing",
        "color",
        "horizontal_align",
        "vertical_align",
        "rotation"
      ]
    },
    {
      "id": "d-nh-cho-qu-n-l",
      "role": "subheading",
      "html_tag": "h3",
      "example_value": "Dành cho Quản Lý",
      "editable": true,
      "allow_empty": true,
      "bounds": {
        "x": 0.0388969,
        "y": 0.6313693,
        "width": 0.157875,
        "height": 0.0406667
      },
      "anchor": "start",
      "horizontal_align": "left",
      "vertical_align": "top",
      "rotation": 0.0,
      "z_order": 4,
      "typography": {
        "font_family": "Proxima Nova",
        "font_size": 36.0,
        "font_size_unit": "source-unit",
        "font_weight": "bold",
        "font_style": "italic",
        "line_height": 1.0,
        "letter_spacing": "normal",
        "color": "#171717"
      },
      "source_refs": [
        {
          "text_index": 2,
          "tspan_index": 1,
          "run_index": 0,
          "character_range": [
            0,
            16
          ]
        }
      ],
      "style_overrides": [
        "example_value",
        "bounds",
        "font_family",
        "font_size",
        "font_weight",
        "font_style",
        "line_height",
        "letter_spacing",
        "color",
        "horizontal_align",
        "vertical_align",
        "rotation"
      ]
    },
    {
      "id": "interview",
      "role": "title",
      "html_tag": "h1",
      "example_value": "INTERVIEW",
      "editable": true,
      "allow_empty": true,
      "bounds": {
        "x": 0.0392718,
        "y": 0.3476942,
        "width": 0.3790187,
        "height": 0.1355556
      },
      "anchor": "start",
      "horizontal_align": "left",
      "vertical_align": "top",
      "rotation": 0.0,
      "z_order": 5,
      "typography": {
        "font_family": "Proxima Nova",
        "font_size": 120.0,
        "font_size_unit": "source-unit",
        "font_weight": "800",
        "font_style": "normal",
        "line_height": 1.0,
        "letter_spacing": "normal",
        "color": "#171717"
      },
      "source_refs": [
        {
          "text_index": 3,
          "tspan_index": 0,
          "run_index": 0,
          "character_range": [
            0,
            10
          ]
        }
      ],
      "style_overrides": [
        "example_value",
        "bounds",
        "font_family",
        "font_size",
        "font_weight",
        "font_style",
        "line_height",
        "letter_spacing",
        "color",
        "horizontal_align",
        "vertical_align",
        "rotation"
      ]
    },
    {
      "id": "workshop",
      "role": "title",
      "html_tag": "h1",
      "example_value": "WORKSHOP",
      "editable": true,
      "allow_empty": true,
      "bounds": {
        "x": 0.0392718,
        "y": 0.4588053,
        "width": 0.363325,
        "height": 0.1355556
      },
      "anchor": "start",
      "horizontal_align": "left",
      "vertical_align": "top",
      "rotation": 0.0,
      "z_order": 6,
      "typography": {
        "font_family": "Proxima Nova",
        "font_size": 120.0,
        "font_size_unit": "source-unit",
        "font_weight": "800",
        "font_style": "normal",
        "line_height": 1.0,
        "letter_spacing": "normal",
        "color": "#171717"
      },
      "source_refs": [
        {
          "text_index": 3,
          "tspan_index": 1,
          "run_index": 0,
          "character_range": [
            0,
            8
          ]
        }
      ],
      "style_overrides": [
        "example_value",
        "bounds",
        "font_family",
        "font_size",
        "font_weight",
        "font_style",
        "line_height",
        "letter_spacing",
        "color",
        "horizontal_align",
        "vertical_align",
        "rotation"
      ]
    },
    {
      "id": "hra-department",
      "role": "label",
      "html_tag": "span",
      "example_value": "HRA DEPARTMENT",
      "editable": true,
      "allow_empty": true,
      "bounds": {
        "x": 0.8598722,
        "y": 0.0785151,
        "width": 0.0906011,
        "height": 0.0225926
      },
      "anchor": "start",
      "horizontal_align": "left",
      "vertical_align": "top",
      "rotation": 0.0,
      "z_order": 7,
      "typography": {
        "font_family": "ProximaNova-Regular",
        "font_size": 20.0,
        "font_size_unit": "source-unit",
        "font_weight": "400",
        "font_style": "normal",
        "line_height": 1.0,
        "letter_spacing": "normal",
        "color": "#171717"
      },
      "source_refs": [
        {
          "text_index": 4,
          "tspan_index": 0,
          "run_index": 0,
          "character_range": [
            0,
            14
          ]
        }
      ],
      "style_overrides": [
        "example_value",
        "bounds",
        "font_family",
        "font_size",
        "font_weight",
        "font_style",
        "line_height",
        "letter_spacing",
        "color",
        "horizontal_align",
        "vertical_align",
        "rotation"
      ]
    }
  ]
}
