{
  "schema_version": 1,
  "coordinate_space": {
    "unit": "normalized",
    "width": 1,
    "height": 1
  },
  "source": {
    "svg": "../evidence/source-with-text.svg",
    "view_box": [
      0.0,
      0.0,
      1920.0,
      1080.0
    ],
    "canvas_width": 1920.0,
    "canvas_height": 1080.0
  },
  "artwork_text_exemptions": [],
  "slots": [
    {
      "id": "thi-t-l-p",
      "role": "title",
      "html_tag": "h1",
      "example_value": "THIẾT LẬP",
      "editable": true,
      "allow_empty": true,
      "bounds": {
        "x": 0.0376347,
        "y": 0.3269792,
        "width": 0.3558951,
        "height": 0.1549963
      },
      "anchor": "start",
      "horizontal_align": "left",
      "vertical_align": "top",
      "rotation": 0.0,
      "z_order": 1,
      "typography": {
        "font_family": "ProximaNova-Black",
        "font_size": 137.2098,
        "font_size_unit": "source-unit",
        "font_weight": "bold",
        "font_style": "normal",
        "line_height": 1.0,
        "letter_spacing": "normal",
        "color": "#ffffff"
      },
      "source_refs": [
        {
          "text_index": 0,
          "tspan_index": 0,
          "run_index": 0,
          "character_range": [
            0,
            9
          ]
        }
      ],
      "style_overrides": [
        "example_value",
        "bounds",
        "font_family",
        "font_size",
        "font_weight",
        "font_style",
        "line_height",
        "letter_spacing",
        "color",
        "horizontal_align",
        "vertical_align",
        "rotation"
      ]
    },
    {
      "id": "m-c-ti-u",
      "role": "title",
      "html_tag": "h1",
      "example_value": "MỤC TIÊU",
      "editable": true,
      "allow_empty": true,
      "bounds": {
        "x": 0.0376347,
        "y": 0.4744798,
        "width": 0.3388582,
        "height": 0.1549963
      },
      "anchor": "start",
      "horizontal_align": "left",
      "vertical_align": "top",
      "rotation": 0.0,
      "z_order": 2,
      "typography": {
        "font_family": "ProximaNova-Black",
        "font_size": 137.2098,
        "font_size_unit": "source-unit",
        "font_weight": "bold",
        "font_style": "normal",
        "line_height": 1.0,
        "letter_spacing": "normal",
        "color": "#ffffff"
      },
      "source_refs": [
        {
          "text_index": 0,
          "tspan_index": 1,
          "run_index": 0,
          "character_range": [
            0,
            8
          ]
        }
      ],
      "style_overrides": [
        "example_value",
        "bounds",
        "font_family",
        "font_size",
        "font_weight",
        "font_style",
        "line_height",
        "letter_spacing",
        "color",
        "horizontal_align",
        "vertical_align",
        "rotation"
      ]
    }
  ]
}
